{
  "alert_count": 15,
  "alert_range_utc": {
    "end": "2026-09-04T17:45:00Z",
    "start": "2026-08-31T05:58:00Z"
  },
  "alerts": [
    {
      "alert_id": "67ef42d64577f5fd950539fa9e7c505b2b791e20ca32181a0e5a5b6208045360",
      "alert_local_time": "2026-08-31T08:58:00+03:00",
      "alert_utc_time": "2026-08-31T05:58:00Z",
      "direction": "SELL",
      "entry_price": 4445.45,
      "max_favorable_move": 116.0,
      "max_favorable_move_unit": "pips",
      "outcome_status": "FILLED",
      "raw_symbol": "XAUUSD",
      "source_row_index": 3,
      "targets_hit_visible": 0,
      "transcription_confidence": "HIGH"
    },
    {
      "alert_id": "92e8d4698e58752d019244cdd855d3a01fca2674a12a76cd4e9a2e971f29089b",
      "alert_local_time": "2026-08-31T16:04:00+03:00",
      "alert_utc_time": "2026-08-31T13:04:00Z",
      "direction": "SELL",
      "entry_price": 4445.45,
      "max_favorable_move": 297.0,
      "max_favorable_move_unit": "pips",
      "outcome_status": "FILLED",
      "raw_symbol": "XAUUSD",
      "source_row_index": 7,
      "targets_hit_visible": 1,
      "transcription_confidence": "HIGH"
    },
    {
      "alert_id": "a8345fd25dac06fc80b70e4b72da7d6320926859dbc93fdf64fada70ca4fec3c",
      "alert_local_time": "2026-08-31T16:16:00+03:00",
      "alert_utc_time": "2026-08-31T13:16:00Z",
      "direction": "SELL",
      "entry_price": 4445.45,
      "max_favorable_move": 934.0,
      "max_favorable_move_unit": "pips",
      "outcome_status": "FILLED",
      "raw_symbol": "XAUUSD",
      "source_row_index": 8,
      "targets_hit_visible": 3,
      "transcription_confidence": "HIGH"
    },
    {
      "alert_id": "ce2b9a53a330b08d3eb5185b0c8c81e0bb652ce3cb35fe0fa90bf66560fcb510",
      "alert_local_time": "2026-09-01T12:21:00+03:00",
      "alert_utc_time": "2026-09-01T09:21:00Z",
      "direction": "BUY",
      "entry_price": 4376.48,
      "max_favorable_move": null,
      "max_favorable_move_unit": "pips",
      "outcome_status": "NOT_FILLED",
      "raw_symbol": "XAUUSD",
      "source_row_index": 11,
      "targets_hit_visible": 0,
      "transcription_confidence": "HIGH"
    },
    {
      "alert_id": "a8723e2acf7dad834bd9789b1094640a9cbde2f4836f682ec01cdd381dc53d21",
      "alert_local_time": "2026-09-01T17:24:00+03:00",
      "alert_utc_time": "2026-09-01T14:24:00Z",
      "direction": "SELL",
      "entry_price": 4396.52,
      "max_favorable_move": 320.0,
      "max_favorable_move_unit": "pips",
      "outcome_status": "FILLED",
      "raw_symbol": "XAUUSD",
      "source_row_index": 12,
      "targets_hit_visible": 0,
      "transcription_confidence": "HIGH"
    },
    {
      "alert_id": "e279c552d1b7e8ab18c8f45b66a9c08a7cff040ad620c745ac43e3b45c24537d",
      "alert_local_time": "2026-09-02T19:05:00+03:00",
      "alert_utc_time": "2026-09-02T16:05:00Z",
      "direction": "SELL",
      "entry_price": 4373.35,
      "max_favorable_move": 88.0,
      "max_favorable_move_unit": "pips",
      "outcome_status": "FILLED",
      "raw_symbol": "XAUUSD",
      "source_row_index": 13,
      "targets_hit_visible": 0,
      "transcription_confidence": "HIGH"
    },
    {
      "alert_id": "7dc1a9c17176a0e5ba96ea14df6923226b6d6612d9cc4dfeedd7dcd979b80c15",
      "alert_local_time": "2026-09-03T02:49:00+03:00",
      "alert_utc_time": "2026-09-02T23:49:00Z",
      "direction": "SELL",
      "entry_price": 4386.6,
      "max_favorable_move": 41.0,
      "max_favorable_move_unit": "pips",
      "outcome_status": "FILLED",
      "raw_symbol": "XAUUSD",
      "source_row_index": 14,
      "targets_hit_visible": 0,
      "transcription_confidence": "HIGH"
    },
    {
      "alert_id": "28a1857618d864d38c515f18da6f8674c8cc10e140ffd0942d50d16b9e253506",
      "alert_local_time": "2026-09-03T06:34:00+03:00",
      "alert_utc_time": "2026-09-03T03:34:00Z",
      "direction": "BUY",
      "entry_price": 4430.08,
      "max_favorable_move": 103.0,
      "max_favorable_move_unit": "pips",
      "outcome_status": "FILLED",
      "raw_symbol": "XAUUSD",
      "source_row_index": 15,
      "targets_hit_visible": 0,
      "transcription_confidence": "HIGH"
    },
    {
      "alert_id": "419981bef520c4a592ecf545e804c612501c5a783154c71e8ccd786df9b0f0d2",
      "alert_local_time": "2026-09-03T08:00:00+03:00",
      "alert_utc_time": "2026-09-03T05:00:00Z",
      "direction": "SELL",
      "entry_price": 4445.45,
      "max_favorable_move": 264.0,
      "max_favorable_move_unit": "pips",
      "outcome_status": "FILLED",
      "raw_symbol": "XAUUSD",
      "source_row_index": 16,
      "targets_hit_visible": 0,
      "transcription_confidence": "HIGH"
    },
    {
      "alert_id": "4da5d724813ff37b482ca88be5cd2055cec072bc34651ae3f0e037e851109a8e",
      "alert_local_time": "2026-09-03T13:25:00+03:00",
      "alert_utc_time": "2026-09-03T10:25:00Z",
      "direction": "BUY",
      "entry_price": 4425.1,
      "max_favorable_move": 252.0,
      "max_favorable_move_unit": "pips",
      "outcome_status": "FILLED",
      "raw_symbol": "XAUUSD",
      "source_row_index": 17,
      "targets_hit_visible": 2,
      "transcription_confidence": "HIGH"
    },
    {
      "alert_id": "481df861c79af5624745e37fd4fb83b3e2981f3d4f8e363acccdfabd19fc33b1",
      "alert_local_time": "2026-09-03T15:13:00+03:00",
      "alert_utc_time": "2026-09-03T12:13:00Z",
      "direction": "BUY",
      "entry_price": 4425.0,
      "max_favorable_move": null,
      "max_favorable_move_unit": "pips",
      "outcome_status": "NOT_FILLED",
      "raw_symbol": "XAUUSD",
      "source_row_index": 18,
      "targets_hit_visible": 0,
      "transcription_confidence": "HIGH"
    },
    {
      "alert_id": "71b4a8966762d0aa68f24efbe5575f103b55546ab37c583f73c57044df110805",
      "alert_local_time": "2026-09-04T02:01:00+03:00",
      "alert_utc_time": "2026-09-03T23:01:00Z",
      "direction": "BUY",
      "entry_price": 4475.01,
      "max_favorable_move": 125.0,
      "max_favorable_move_unit": "pips",
      "outcome_status": "FILLED",
      "raw_symbol": "XAUUSD",
      "source_row_index": 21,
      "targets_hit_visible": 0,
      "transcription_confidence": "HIGH"
    },
    {
      "alert_id": "57955dac10b25f5f002052fea97ae1b285e147241dba0fe0f84213ae7413cfa8",
      "alert_local_time": "2026-09-04T10:25:00+03:00",
      "alert_utc_time": "2026-09-04T07:25:00Z",
      "direction": "SELL",
      "entry_price": 4467.78,
      "max_favorable_move": 0.0,
      "max_favorable_move_unit": "pips",
      "outcome_status": "NO_PROFIT",
      "raw_symbol": "XAUUSD",
      "source_row_index": 25,
      "targets_hit_visible": 0,
      "transcription_confidence": "HIGH"
    },
    {
      "alert_id": "f3053af6d670c188f5ebe00cedc3dee9f8a48c4805991fa4f24f165d2e3de0b0",
      "alert_local_time": "2026-09-04T11:05:00+03:00",
      "alert_utc_time": "2026-09-04T08:05:00Z",
      "direction": "BUY",
      "entry_price": 4482.45,
      "max_favorable_move": 17.0,
      "max_favorable_move_unit": "pips",
      "outcome_status": "BELOW_THRESHOLD",
      "raw_symbol": "XAUUSD",
      "source_row_index": 26,
      "targets_hit_visible": 0,
      "transcription_confidence": "HIGH"
    },
    {
      "alert_id": "3c3493e83c0545acd3a76183ffd7a742b2cdbb1b49391ebc45bede32f4d40278",
      "alert_local_time": "2026-09-04T20:45:00+03:00",
      "alert_utc_time": "2026-09-04T17:45:00Z",
      "direction": "SELL",
      "entry_price": 4416.97,
      "max_favorable_move": 50.0,
      "max_favorable_move_unit": "pips",
      "outcome_status": "FILLED",
      "raw_symbol": "XAUUSD",
      "source_row_index": 27,
      "targets_hit_visible": 0,
      "transcription_confidence": "HIGH"
    }
  ],
  "created_at": "2026-09-07T17:11:12.980393Z",
  "golden_set_id": "a3e4622f166e4e9be08baac5ee16e3ec26c308bbb4120067c0d90f22405461b5",
  "golden_set_version": "manual-tree-golden-alerts-0.1.0",
  "mode": "MANUAL_TREE_GOLDEN_ALERTS",
  "raw_symbol": "XAUUSD",
  "source": "USER_PROVIDED_TRADE_SUMMARY_SCREENSHOT",
  "source_timezone": "Asia/Jerusalem",
  "timestamp_semantics": "ALERT_TIME"
}
